[{"schema":"relatte.dynamic-field-event.experimental/v0","event_id":"event:8f64ff48-1121-4e26-9ebe-5d671c524b32","world_id":"world:cd20b6eb659f244a415f4dcf32d93d3ec44642f1dba3fec1cddf46922eb97269","seq":0,"previous":null,"at_ms":1000,"kind":"genesis","payload":{"parent":null},"public_key":"MCowBQYDK2VwAyEADv1r8Pl7AhV6avNOrt5DbjHEREzrRj8+T+sbRllckAE=","signature":"hhKj++0Ex5OK9nq8W8uQQsnnEI0I6G0o+t57zk3WJ62DhR0a/N9u7icWYfx3MoglXRxVFfWijmMwSnjiWUxhCg=="}]