[{"schema":"relatte.dynamic-field-event.experimental/v0","event_id":"event:fd8e3b7b-3899-4586-93b5-91bf8357a551","world_id":"world:6506087b58a232047c933cc203523f89e59171c75add4687fccc13af703e585b","seq":0,"previous":null,"at_ms":1000,"kind":"genesis","payload":{"parent":null},"public_key":"MCowBQYDK2VwAyEAGBQavc3w0tye1QLG1aPPDfsI3Mx6zyAJ3FCUspFiRN0=","signature":"9Y7OhT4rgphSEHJKuToO4zZZrkMauj3thvLh4LFY7OAQSEeI6Rs1dApY/BdGCqN0wyJKSJPyfZhbwarkTY3dDQ=="},{"schema":"relatte.dynamic-field-event.experimental/v0","event_id":"event:8af08345-e7fc-4c0a-934a-f6c1b4e67748","world_id":"world:6506087b58a232047c933cc203523f89e59171c75add4687fccc13af703e585b","seq":1,"previous":"sha256:685e8be5d41a3cbd6d6636458decf315572cd828d2e13a54a0e520a521beaef1","at_ms":1000,"kind":"publish","payload":{"offer_id":"offer:1841a5ed-be19-459b-b484-5c501f2f5f97","descriptor":{"schema":"relatte.interface-particular.experimental/v0","interface_id":"interface:552dd703-9534-4075-a884-33125591fc50","participant_ref":"composition-instance-v0:4c86f8481adc566992dea6cba8eedcf0cc8300848d549fc47bc7acb77189585d","plane":"transport","direction":"bidirectional","protocol":"in-process/v0","accepts":["file.bytes"],"emits":["file.bytes"],"operations":["observe","transmit","receive","propose"],"authority":{"observe":true,"propose":true,"authorize":false,"mutate":false},"information":{"capacity":1048576,"capacity_unit":"payload-bytes","timing_model":"occurrence time","ordering":"ordered","delivery":"bounded local observation","loss_profile":[],"native_dimensions":["path","device","inode"]},"state":{"retention":"persistent","replayable":true},"evidence":{"produces":["native receipt"],"verification":["binding-local verification"],"source_ref":"polyglot-crossing-001 observeFilesystem"},"constraints":{"required":[],"forbidden":["authorize"]},"live":true,"capabilities":["observe","transmit","receive","propose"]},"descriptor_digest":"sha256:2002b2b22f23a33c0a52118483f81eab5f1911ec2d010abe6f090872cb4346cc","expires_at":61000,"parents":[{"world_id":"world:218b8340514975b70f9e0f022292fcb30275e2d9aad9cea252e6fa2520fe69de","interface_id":"interface:552dd703-9534-4075-a884-33125591fc50","offer_id":"offer:720aa418-f84e-4b60-bc38-c3ccaaa85c28"}]},"public_key":"MCowBQYDK2VwAyEAGBQavc3w0tye1QLG1aPPDfsI3Mx6zyAJ3FCUspFiRN0=","signature":"xnyPZuIG/78zDGrnopeNYOPy6K/MYTj4JTMa/INdHEj8JmsBtPpbdjGYQbscj1kUvPfbKfRiXRo5bO0Mfa8ABg=="},{"schema":"relatte.dynamic-field-event.experimental/v0","event_id":"event:fab451ee-e29b-4125-a416-d63b42a323e5","world_id":"world:6506087b58a232047c933cc203523f89e59171c75add4687fccc13af703e585b","seq":2,"previous":"sha256:8bd8fc0daf0097efb15d526d670f6fe73c8cb9dcdd7ad3faa109e12dcac1efca","at_ms":1000,"kind":"publish","payload":{"offer_id":"offer:24ce150b-d54a-4827-ad55-c98936ce64ee","descriptor":{"schema":"relatte.interface-particular.experimental/v0","interface_id":"interface:eb1d970e-82b5-4570-acd1-bbeda03222cf","participant_ref":"composition-instance-v0:4c86f8481adc566992dea6cba8eedcf0cc8300848d549fc47bc7acb77189585d","plane":"transport","direction":"bidirectional","protocol":"in-process/v0","accepts":["file.bytes"],"emits":["file.bytes"],"operations":["observe","transmit","receive","propose"],"authority":{"observe":true,"propose":true,"authorize":false,"mutate":false},"information":{"capacity":1048576,"capacity_unit":"payload-bytes","timing_model":"occurrence time","ordering":"ordered","delivery":"bounded local observation","loss_profile":[],"native_dimensions":["path","device","inode"]},"state":{"retention":"persistent","replayable":true},"evidence":{"produces":["native receipt"],"verification":["binding-local verification"],"source_ref":"polyglot-crossing-001 observeFilesystem"},"constraints":{"required":[],"forbidden":["authorize"]},"live":true,"capabilities":["observe","transmit","receive","propose"]},"descriptor_digest":"sha256:50cb95282bc630312b4798ff07faaa04c2eb78ae6add541c243835ae7ad6a06c","expires_at":61000,"parents":[{"world_id":"world:6506087b58a232047c933cc203523f89e59171c75add4687fccc13af703e585b","interface_id":"interface:552dd703-9534-4075-a884-33125591fc50","offer_id":"offer:1841a5ed-be19-459b-b484-5c501f2f5f97"},{"world_id":"world:218b8340514975b70f9e0f022292fcb30275e2d9aad9cea252e6fa2520fe69de","interface_id":"interface:eb1d970e-82b5-4570-acd1-bbeda03222cf","offer_id":"offer:87e5cd90-6e60-40d2-8963-b414949f0af6"}]},"public_key":"MCowBQYDK2VwAyEAGBQavc3w0tye1QLG1aPPDfsI3Mx6zyAJ3FCUspFiRN0=","signature":"bsbqQY5x26dJx7fr3oOHS/ltGpK/dsje88N5BpslWfpMp7LT0d9W/lQB6GZlzF9exM/poflHMEgCk1Ok3N40BA=="},{"schema":"relatte.dynamic-field-event.experimental/v0","event_id":"event:a1a78338-9cad-4dbf-bb2f-b91b489005ee","world_id":"world:6506087b58a232047c933cc203523f89e59171c75add4687fccc13af703e585b","seq":3,"previous":"sha256:6b34dc011e62333df5aa28ff553753fd26ec63905e7ee334a3c14cdd677efe3d","at_ms":1000,"kind":"relation-publish","payload":{"offer_id":"relation-offer:77847ece-e9b7-4664-afea-0021182d7972","descriptor":{"schema":"relatte.interface-relation.experimental/v0","relation_id":"relation:6dbca995-b600-4275-bdda-404390808f12","source":"interface:808b5966","destination":"interface:552dd703-9534-4075-a884-33125591fc50","kind":"transform","consumes":"payload.bytes","produces":"file.bytes","operation":"observe","preconditions":[],"postconditions":["ordered"],"removes":[],"preserves":{"bytes":true,"semantics":true,"ancestry":true,"order":true,"timing":false,"particular_identity":false},"may_lose":[],"reversible":true,"loss_cost":0,"requires":{"network":false,"live_participant":true,"local_state":false,"witness":null,"authority":"observe"},"binding_ref":"binding:2c268110","verification_ref":"verification:2c268110"},"source":{"world_id":"world:88a5dc9d62913f13705305796f7018129f70e2743d7bf3f0911cc413efe2c121","interface_id":"interface:808b5966","offer_id":"offer:01bfb3e5-4005-492f-985c-9fd05c56aabc","descriptor_digest":"sha256:27e710eb35fb98e461660b921ececf1c5444e54598250270045a2caaab1dacb3"},"destination":{"world_id":"world:6506087b58a232047c933cc203523f89e59171c75add4687fccc13af703e585b","interface_id":"interface:552dd703-9534-4075-a884-33125591fc50","offer_id":"offer:1841a5ed-be19-459b-b484-5c501f2f5f97","descriptor_digest":"sha256:2002b2b22f23a33c0a52118483f81eab5f1911ec2d010abe6f090872cb4346cc"},"expires_at":61000},"public_key":"MCowBQYDK2VwAyEAGBQavc3w0tye1QLG1aPPDfsI3Mx6zyAJ3FCUspFiRN0=","signature":"izTxzqXFogibzDTltUJZvnd3d1gCt/EoKG1DSM8SmUm8ZtxH8ZTNnCJTm2JU1xjgoYBO23kMsB71/moXshczBA=="},{"schema":"relatte.dynamic-field-event.experimental/v0","event_id":"event:8ed1d8aa-58d4-4028-a1d9-a8a77d33e306","world_id":"world:6506087b58a232047c933cc203523f89e59171c75add4687fccc13af703e585b","seq":4,"previous":"sha256:c2209f4a1e190ead0984c4690dd43c9488772636fc6a8a12659f99dc1d19dee1","at_ms":1000,"kind":"grant","payload":{"schema":"relatte.dynamic-door-grant.experimental/v0","grant_id":"grant:1f30342c-790a-4718-9f89-4098d7a7705f","world_id":"world:6506087b58a232047c933cc203523f89e59171c75add4687fccc13af703e585b","interface_id":"interface:552dd703-9534-4075-a884-33125591fc50","offer_id":"offer:1841a5ed-be19-459b-b484-5c501f2f5f97","descriptor_digest":"sha256:2002b2b22f23a33c0a52118483f81eab5f1911ec2d010abe6f090872cb4346cc","subject":"visitor","operation":"observe","permission":"observe","expires_at":61000,"max_uses":1,"public_key":"MCowBQYDK2VwAyEAGBQavc3w0tye1QLG1aPPDfsI3Mx6zyAJ3FCUspFiRN0=","signature":"BIGTwhcfFWkqT7iC9IjNRucrb+deftCzUU8nXYTMnMTzm9IP+zbH+QAC3DnCP/dI1+cfeoHZv3AdAryat9z/BQ=="},"public_key":"MCowBQYDK2VwAyEAGBQavc3w0tye1QLG1aPPDfsI3Mx6zyAJ3FCUspFiRN0=","signature":"kENtsiU3kGdyzbwoCMmDZ6BuNBDb+xyNFMPzaqlLsjTQZUXPF5b/ECDL2t4x2INg2zOTJTzNhe4ZrHAR64eSBw=="}]